{
  "registerId": "math-quest-art-design-decisions",
  "version": "1.4.3",
  "schemaVersion": 1,
  "status": "ACTIVE",
  "primaryConsumer": "AI_AGENT",
  "authority": "THIS_FILE",
  "licence": {
    "spdx": "MIT",
    "scope": "Original Math Quest dispositions, replacement predicates, Conservatory direction, and art-production workflow derived from owner-authorized source suggestions.",
    "originalWork": true
  },
  "sourceBundle": {
    "fileName": "Math_Quest_Art_Design_Bible_IP_Neutral_v1.0.zip",
    "sha256": "5bd82f8fa9fb18b896569ed6329a18424db021914a03b7e73a280e852ac18353",
    "internalRoot": "Math_Quest_Art_Design_Bible_IP_Neutral_v1.0",
    "internalManifestSha256": "6674e6b5bbb6ec675ba945b82411871de6151bece5b881eb6a9d70acfff107c8",
    "decisionRegisterPath": "03_Decision_Register.md",
    "decisionRegisterSha256": "7ad8cb3b3cc309b0c9da4b3e004e1c801cb37b7d3040692765856949a9ebfee6",
    "fileCount": 44,
    "verifiedFileCount": 43,
    "authorityClass": "SOURCE_SUGGESTION_ONLY",
    "repositoryProjectionPolicy": "DIRECT_SOURCE_PROJECTION_FORBIDDEN",
    "rightsBasis": "OWNER_CONFIRMED_ORIGINAL_WORK_AUTHORIZED_FOR_MIT_ADAPTATION_2026_08_22"
  },
  "interpretation": {
    "normativeFields": [
      "designRules[].predicate",
      "designRules[].constraints",
      "implementationDecisionLog.entries[].decisionId",
      "implementationDecisionLog.entries[].constraints",
      "themePolicy",
      "constructionWorkflow",
      "migrationSequence"
    ],
    "rationalePolicy": "NON_NORMATIVE_LOCAL_EXPLANATION_NEVER_OVERRIDES_PREDICATE",
    "conflictPolicy": "REPOSITORY_OWNER_CONTRACTS_OVERRIDE_SOURCE_BUNDLE",
    "unknownPolicy": "FAIL_CLOSED",
    "mockupPolicy": "REFERENCE_ONLY_NEVER_MATHEMATICAL_OR_UI_AUTHORITY",
    "runtimeActivationPolicy": "EXPLICIT_VERTICAL_SLICE_REVIEW_AND_GATE_REQUIRED"
  },
  "orderingContract": [
    { "jsonPointer": "/semanticClasses", "policy": "LEXICOGRAPHIC_BY_ID" },
    { "jsonPointer": "/constructionWorkflow/stages", "policy": "ORDER_ASCENDING" },
    { "jsonPointer": "/constructionWorkflow/steps", "policy": "ORDER_ASCENDING" },
    { "jsonPointer": "/sourceDecisions", "policy": "SOURCE_NUMBER_ASCENDING" },
    { "jsonPointer": "/designRules", "policy": "LEXICOGRAPHIC_BY_ID" },
    { "jsonPointer": "/implementationDecisionLog/entries", "policy": "ORDER_ASCENDING_APPEND_ONLY" },
    { "jsonPointer": "/migrationSequence", "policy": "ORDER_ASCENDING" }
  ],
  "semanticClasses": [
    { "id": "ATMOSPHERIC", "predicate": "CANNOT_DEFINE_INSTRUCTION_CONTROL_STATE_MATHEMATICAL_FACT_OR_ANSWER" },
    { "id": "FUNCTIONAL", "predicate": "COMMUNICATES_CONTROL_NAVIGATION_OR_STATUS_WITH_ACCESSIBLE_EQUIVALENT" },
    { "id": "MATHEMATICAL", "predicate": "COMMUNICATES_QUANTITY_GROUPING_ORDER_OPERATION_EQUALITY_GEOMETRY_OR_ANSWER" }
  ],
  "themePolicy": {
    "worldIdentity": "MATHEMATICAL_CONSERVATORY_AND_WORKSHOP",
    "scope": "ALL_USER_FACING_ROUTES",
    "viewModes": ["OCEAN", "FOREST", "SPACE"],
    "mathThemeBoundary": "THEMES_AFFECT_ATMOSPHERE_ONLY_NOT_MATHEMATICAL_FACTS_PIECES_COLOURS_OR_GEOMETRY",
    "legacyTransition": "REPLACE_THEME_DEPENDENT_MATH_PIECES_ONLY_AFTER_NEUTRAL_EQUIVALENT_PASSES_CLARITY_AND_PLAY_TESTS",
    "featurePreservation": "VISUAL_RECOMPOSITION_MUST_NOT_REMOVE_HIDE_RENAME_OR_CHANGE_GOVERNED_FEATURES_CONTROLS_STRINGS_OR_FLOWS",
    "progressTruthOwner": "CURRENT_RUNTIME_AND_CURRICULUM_CONTRACTS"
  },
  "constructionWorkflow": {
    "workflowId": "ART-WORKFLOW-CONSTRUCTION-FIRST-53",
    "appliesTo": "ALL_NEW_OR_MATERIALLY_REVISED_GAME_ART_HUMAN_OR_AI_CREATED",
    "governingPriority": "MATHEMATICAL_TRUTH_AND_INSTRUCTIONAL_CLARITY_OVERRIDE_ART_REALISM",
    "laterStageConcealmentPolicy": "FORBIDDEN",
    "notApplicablePolicy": "WRITTEN_REASON_REQUIRED_PER_STEP",
    "stages": [
      { "id": "COORDINATES", "order": 1 },
      { "id": "PERSPECTIVE", "order": 2 },
      { "id": "ENVELOPE", "order": 3 },
      { "id": "BOXES", "order": 4 },
      { "id": "AXES", "order": 5 },
      { "id": "SECTIONS", "order": 6 },
      { "id": "CURVES", "order": 7 },
      { "id": "CONTOUR", "order": 8 },
      { "id": "SHADOWS", "order": 9 },
      { "id": "VALUES", "order": 10 },
      { "id": "COLOUR", "order": 11 },
      { "id": "MATERIALS", "order": 12 },
      { "id": "DETAIL", "order": 13 }
    ],
    "tiers": [
      { "id": "TIER_1", "assetClass": "MAJOR_SCENE_HOME_MILESTONE_OR_COMPLEX_ARCHITECTURE", "minimumApplicableSteps": 53, "maximumApplicableSteps": 53, "fullStageSequenceRequired": true },
      { "id": "TIER_2", "assetClass": "SUBSTANTIAL_REUSABLE_ASSET", "minimumApplicableSteps": 25, "maximumApplicableSteps": 35, "fullStageSequenceRequired": true },
      { "id": "TIER_3", "assetClass": "FUNCTIONAL_SVG_PLAQUE_REGISTRATION_MARK_OR_SMALL_EMBLEM", "minimumApplicableSteps": 13, "maximumApplicableSteps": 24, "fullStageSequenceRequired": true }
    ],
    "steps": [
      { "id": "ART-WF-01", "order": 1, "stage": "COORDINATES", "directive": "RECORD_FINAL_DESTINATION_AND_OUTPUT_CONDITIONS", "rationale": "Output conditions determine the real composition and prevent arbitrary source dimensions.", "falsePassPrevented": "ARBITRARY_CANVAS_MISTAKEN_FOR_RESPONSIVE_DESIGN" },
      { "id": "ART-WF-02", "order": 2, "stage": "COLOUR", "directive": "CREATE_COLOUR_MANAGED_EDITABLE_MASTER", "rationale": "A managed editable master prevents display effects and destructive edits from becoming authority.", "falsePassPrevented": "DISPLAY_ENHANCEMENT_OR_FLATTENED_FILE_MISTAKEN_FOR_MASTER" },
      { "id": "ART-WF-03", "order": 3, "stage": "COORDINATES", "directive": "ESTABLISH_FILE_VERSION_AND_RECOVERY_STRUCTURE", "rationale": "Milestones preserve the originating stage of defects and permit safe correction.", "falsePassPrevented": "FINAL_ONLY_FILE_CONCEALS_UNRECOVERABLE_DECISIONS" },
      { "id": "ART-WF-04", "order": 4, "stage": "COORDINATES", "directive": "BUILD_RIGHTS_REVIEWED_REFERENCE_DOSSIER", "rationale": "Purpose-bound references prevent accidental geometry mixing and unreviewed rights exposure.", "falsePassPrevented": "REFERENCE_COLLAGE_MISTAKEN_FOR_COHERENT_AUTHORITY" },
      { "id": "ART-WF-05", "order": 5, "stage": "PERSPECTIVE", "directive": "DECLARE_VISUAL_TRUTH_MODEL", "rationale": "A declared realism model prevents incompatible lenses lights and architectural facts.", "falsePassPrevented": "INCOMPATIBLE_VISUAL_FACTS_APPEAR_PLAUSIBLE_IN_ISOLATION" },
      { "id": "ART-WF-06", "order": 6, "stage": "PERSPECTIVE", "directive": "ANALYSE_PRINCIPAL_SPATIAL_AUTHORITY", "rationale": "Camera and value analysis must precede decorative interpretation.", "falsePassPrevented": "AI_CONCEPT_OR_DETAIL_BECOMES_FALSE_CAMERA_AUTHORITY" },
      { "id": "ART-WF-07", "order": 7, "stage": "ENVELOPE", "directive": "CREATE_SIX_TO_NINE_STRUCTURAL_COMPOSITION_CANDIDATES_FOR_TIER_ONE", "rationale": "Structural alternatives expose hierarchy choices before costly rendering.", "falsePassPrevented": "COLOUR_VARIANTS_MISTAKEN_FOR_COMPOSITION_EXPLORATION" },
      { "id": "ART-WF-08", "order": 8, "stage": "VALUES", "directive": "CREATE_TWO_AND_THREE_VALUE_NOTANS", "rationale": "Notans prove hierarchy without relying on hue or detail.", "falsePassPrevented": "COLOUR_CONTRAST_CONCEALS_WEAK_VALUE_STRUCTURE" },
      { "id": "ART-WF-09", "order": 9, "stage": "COLOUR", "directive": "CREATE_THREE_TO_FIVE_LIMITED_COLOUR_KEYS_AFTER_VALUE_APPROVAL", "rationale": "Colour keys test palette while holding geometry and value constant.", "falsePassPrevented": "PALETTE_CHANGE_CONCEALS_COMPOSITION_CHANGE" },
      { "id": "ART-WF-10", "order": 10, "stage": "COORDINATES", "directive": "LOCK_FINAL_IMAGE_RECTANGLE_SAFE_AREAS_AND_NON_EXPORTING_GUIDES", "rationale": "Explicit safe areas protect mathematics and controls across responsive crops.", "falsePassPrevented": "DECORATION_INTRUDES_INTO_INSTRUCTIONAL_FIELD" },
      { "id": "ART-WF-11", "order": 11, "stage": "PERSPECTIVE", "directive": "ESTABLISH_HORIZON_AND_EYE_LEVEL", "rationale": "A locked eye level keeps architecture and scale cues mutually coherent.", "falsePassPrevented": "DETAIL_CONCEALS_INCONSISTENT_EYE_LEVEL" },
      { "id": "ART-WF-12", "order": 12, "stage": "PERSPECTIVE", "directive": "LOCATE_VANISHING_POINTS_AND_DECLARE_PROJECTION", "rationale": "One declared projection prevents mixed spatial systems within an asset.", "falsePassPrevented": "MIXED_PROJECTIONS_PASS_LOCAL_INSPECTION" },
      { "id": "ART-WF-13", "order": 13, "stage": "PERSPECTIVE", "directive": "CHOOSE_ASSET_APPROPRIATE_PERSPECTIVE_METHOD", "rationale": "Perspective must support the asset purpose and flatten where mathematics requires exact judgment.", "falsePassPrevented": "REALISM_DISTORTS_INSTRUCTIONAL_GEOMETRY" },
      { "id": "ART-WF-14", "order": 14, "stage": "COORDINATES", "directive": "BUILD_MINIMUM_MEASURABLE_WORKING_GRID", "rationale": "A hidden measured grid supports repeatable modules without becoming visual noise.", "falsePassPrevented": "DECORATIVE_GRID_MISTAKEN_FOR_CONSTRUCTION_EVIDENCE" },
      { "id": "ART-WF-15", "order": 15, "stage": "BOXES", "directive": "CREATE_PLAN_ELEVATION_OR_SIMPLE_PROXY_WHEN_NEEDED", "rationale": "Simple proxies answer scale and shadow questions without dictating final style.", "falsePassPrevented": "UNMEASURED_ILLUSTRATION_MISTAKEN_FOR_SPATIAL_PROOF" },
      { "id": "ART-WF-16", "order": 16, "stage": "COORDINATES", "directive": "ESTABLISH_WORLD_SCALE_MODULES_SEPARATE_FROM_MATHEMATICAL_SCALE", "rationale": "World modules and mathematical truth require different controlling scales.", "falsePassPrevented": "SCENIC_SCALE_OVERRIDES_MATHEMATICAL_LEGIBILITY" },
      { "id": "ART-WF-17", "order": 17, "stage": "COORDINATES", "directive": "ADD_LOCAL_LABELLED_IMAGE_PLANE_GRID_WHEN_REQUIRED", "rationale": "A local grid enables coordinate comparison without confusing perspective construction.", "falsePassPrevented": "GRID_TYPES_SILENTLY_CONFLATED" },